{
  "schema_version": "0.1",
  "generated_at": "2026-06-02T07:05:26.045041Z",
  "source": {
    "spreadsheet_id": "1gp3jl_DyB8kvxHO7m4YjsCPbFTPGi-XKyqPhGAlTZ60",
    "spreadsheet_url": "https://docs.google.com/spreadsheets/d/1gp3jl_DyB8kvxHO7m4YjsCPbFTPGi-XKyqPhGAlTZ60/edit?ouid=112662517307801676490",
    "title": "[Day 1] 1.0 (from 20250707)",
    "source_artifacts": {
      "live_validated_document_graph": "/Users/kangmin/Documents/excel-workbook-editing/review-packages/sheets-bridge/live-inspections/20260602-day1-1-0/live-validated-document-graph.json",
      "live_evidence_package": "/Users/kangmin/Documents/excel-workbook-editing/review-packages/sheets-bridge/live-inspections/20260602-day1-1-0/live-evidence-package.json",
      "top_left_sample": "/Users/kangmin/Documents/excel-workbook-editing/review-packages/sheets-bridge/live-inspections/20260602-day1-1-0/top-left-sample.json"
    }
  },
  "authority": {
    "source_document": "live_google_sheet",
    "projection_status": "read_model_projection_only",
    "formula_result_authority": "not_established",
    "semantic_review_resolution": "not_performed",
    "shared_ontology_updates": 0
  },
  "method": {
    "name": "connected_sheets_data_view_projection",
    "authority": "validated_graph_projection_not_formula_recalculation",
    "decision_policy": "Project accepted graph nodes into reviewer-facing data views. Preserve formula text and sampled displays as evidence only; do not recalculate formulas, resolve carry-forward queues, or promote semantic ontology updates."
  },
  "data_view_projections": [
    {
      "id": "projection_node_accepted_evidence_body",
      "type": "data_view_projection",
      "projection_kind": "document_summary_projection",
      "source_node_id": "node_accepted_evidence_body",
      "pipeline_id": null,
      "label": "Accepted deterministic evidence",
      "role": "accepted_evidence_body",
      "sheet": null,
      "range": null,
      "input_refs": [],
      "output_refs": [],
      "transform_summary": {},
      "preview": {
        "status": "metadata_only",
        "rows": [],
        "sampled_row_count": 0,
        "sampled_formula_cell_count": 0
      },
      "formula_policy": {
        "formula_text_is_evidence_only": true,
        "formula_result_authority": "not_established",
        "recalculation_not_performed": true
      },
      "warnings": [],
      "evidence_refs": [
        "accepted_evidence"
      ]
    },
    {
      "id": "projection_node_pipeline_pipeline_24_0102_same_sheet_range_24_0102",
      "type": "data_view_projection",
      "projection_kind": "calculation_pipeline_projection",
      "source_node_id": "node_pipeline_pipeline_24_0102_same_sheet_range_24_0102",
      "pipeline_id": "pipeline_24_0102_same_sheet_range_24_0102",
      "label": "24_0102 formula surface",
      "role": "calculation",
      "sheet": "24_0102",
      "range": "B8:T67",
      "input_refs": [
        {
          "id": "block_24_0102_001",
          "kind": "table_candidate",
          "role": "input",
          "sheet": "24_0102",
          "range": "A1:M16",
          "label": "(2023. 12.26~ 2024. 01.01)",
          "authority": "block_candidate"
        }
      ],
      "output_refs": [
        {
          "id": "block_24_0102_formula_surface",
          "kind": "formula_region_candidate",
          "role": "output",
          "sheet": "24_0102",
          "range": "B8:T67",
          "label": "24_0102 formula surface",
          "authority": "block_candidate"
        }
      ],
      "transform_summary": {
        "kind": "formula_dependency_edge",
        "formula_count": 178,
        "signature_group_count": 8,
        "repeated_formula_family": true
      },
      "preview": {
        "status": "sampled_from_top_left_window",
        "rows": [
          {
            "row": 8,
            "cells": [
              {
                "column": 2,
                "display": "119",
                "formula": null
              },
              {
                "column": 3,
                "display": "50",
                "formula": null
              },
              {
                "column": 4,
                "display": "169",
                "formula": null
              },
              {
                "column": 5,
                "display": "9",
                "formula": null
              },
              {
                "column": 6,
                "display": "2",
                "formula": null
              },
              {
                "column": 7,
                "display": "2",
                "formula": null
              },
              {
                "column": 8,
                "display": "11",
                "formula": null
              },
              {
                "column": 9,
                "display": "126",
                "formula": null
              },
              {
                "column": 10,
                "display": "41",
                "formula": null
              },
              {
                "column": 11,
                "display": "167",
                "formula": null
              },
              {
                "column": 12,
                "display": "7",
                "formula": "=I8-B8"
              },
              {
                "column": 13,
                "display": "-9",
                "formula": "=J8-C8"
              }
            ]
          },
          {
            "row": 9,
            "cells": [
              {
                "column": 2,
                "display": "29",
                "formula": null
              },
              {
                "column": 3,
                "display": "7",
                "formula": null
              },
              {
                "column": 4,
                "display": "36",
                "formula": null
              },
              {
                "column": 8,
                "display": "1",
                "formula": null
              },
              {
                "column": 9,
                "display": "29",
                "formula": null
              },
              {
                "column": 10,
                "display": "6",
                "formula": null
              },
              {
                "column": 11,
                "display": "35",
                "formula": null
              },
              {
                "column": 12,
                "display": "0",
                "formula": "=I9-B9"
              },
              {
                "column": 13,
                "display": "-1",
                "formula": "=J9-C9"
              }
            ]
          },
          {
            "row": 10,
            "cells": [
              {
                "column": 2,
                "display": "83",
                "formula": null
              },
              {
                "column": 3,
                "display": "9",
                "formula": null
              },
              {
                "column": 4,
                "display": "92",
                "formula": null
              },
              {
                "column": 7,
                "display": "1",
                "formula": null
              },
              {
                "column": 9,
                "display": "82",
                "formula": null
              },
              {
                "column": 10,
                "display": "9",
                "formula": null
              },
              {
                "column": 11,
                "display": "91",
                "formula": null
              },
              {
                "column": 12,
                "display": "-1",
                "formula": "=I10-B10"
              },
              {
                "column": 13,
                "display": "0",
                "formula": "=J10-C10"
              }
            ]
          },
          {
            "row": 11,
            "cells": [
              {
                "column": 2,
                "display": "50",
                "formula": null
              },
              {
                "column": 3,
                "display": "23",
                "formula": null
              },
              {
                "column": 4,
                "display": "73",
                "formula": null
              },
              {
                "column": 9,
                "display": "50",
                "formula": null
              },
              {
                "column": 10,
                "display": "23",
                "formula": null
              },
              {
                "column": 11,
                "display": "73",
                "formula": null
              },
              {
                "column": 12,
                "display": "0",
                "formula": "=I11-B11"
              },
              {
                "column": 13,
                "display": "0",
                "formula": "=J11-C11"
              }
            ]
          },
          {
            "row": 12,
            "cells": [
              {
                "column": 2,
                "display": "54",
                "formula": null
              },
              {
                "column": 3,
                "display": "2",
                "formula": null
              },
              {
                "column": 4,
                "display": "56",
                "formula": null
              },
              {
                "column": 9,
                "display": "54",
                "formula": null
              },
              {
                "column": 10,
                "display": "2",
                "formula": null
              },
              {
                "column": 11,
                "display": "56",
                "formula": null
              },
              {
                "column": 12,
                "display": "0",
                "formula": "=I12-B12"
              },
              {